,NO,EN
0,Å BLI KIENT MED FOLK,To become kient with people
1,Hamid eri kiosken for å kjøpe aviser. ,Hamid Eri Kiosken to buy newspapers.
2,Han er gift med Påi og er faren til Sara.,He is married to Sara's father.
3,"Vet du hva, Gunnar? I dag er det 15 år siden Pari og jeg kom til Norge fra Iran.","Do you know what, Gunnar?Today is 15 years since Pari and I came to Norway from Iran."
4,Deter ganske lenge siden. Hvordan var det å komme hit?,It is quite a long time ago.How was it to come here?
5,Det var ikke lett. ,It wasn't easy.
6,"I Iran var jeg avdelingsleder på et sykehus der vi bodde, og alle visste hem jeg var.","In Iran, I was head of department at a hospital where we lived, and everyone knew the hem I was."
7,"Men her var det ingen som kente meg, og istedet for å jobbe og tjene penger ble jeg en skoleelev med dårlig råd. ","But here no one is kining me, and instead of working and making money, I became a school student with bad advice."
8,"Det var vanskelig, og det tok lang tid før jeg kunne begynne å jobbe som lege igjen. ","It was difficult, and it took a long time before I could start working as a doctor again."
9,Hvordan var det å lare et nytt språk?,What was it like to learn a new language?
10,Det tok lang tid. Pasientene snakket fort og brukte mange ord jeg ikke kunne. ,It took a long time.The patients talked quickly and used many words I couldn't.
11,Hva gorde du da? Jeg gikk på do. ,What do you give up then?I went to the bathroom.
12,Hva? Jeg tok med meg ei ordbok og gikk på toalettet. ,What?I brought a dictionary and went to the toilet.
13,"Jeg var flau, skjønner du, og derfor villejeg ikke spørre pasientene.","I was embarrassed, you see, and so I would not ask the patients."
14,I dag går det bedre.,Today it is going better.
15,Det har blitt færre turer på toalettet?,There have been fewer trips in the toilet?
16,"Ja, absolutt. Dessuten har jeg bytet ut ordboka med internett. ","Yes absolutely.Also, I have replaced the dictionary with the Internet."
17,Det er likevel et problem for meg at folk snakker sa forskjellig. ,"Still, it is a problem for me that people talk so different."
18,"Noen dialekter er vanskelige, men na er jeg ikke redd for å sporre. ","Some dialects are difficult, but now I'm not afraid to track."
19,Det er bra. Hordan trives du her?,It is good.Hordan do you enjoy here?
20,"Godt, men det er ikke lett å bli kjent med nye mennesker. ","Good, but it is not easy to get to know new people."
21,Jeg er kanskje for gammel. Hva med deg? Har du familie her?,Maybe I'm too old.What about you?Do you have family here?
22,Nei. Familien min bor i Kirkenes. ,No.My family lives in Kirkenes.
23,Jeg forelsket meg iei jente herfra og flyttet hit. ,I fell in love with the girl from here and moved here.
24,Na har jeg bodd her i fire år. Er dere fremdeles sammen?,Now I've lived here for four years.Are you still together?
25,Er dere fremdeles sammen?,Are you still together?
26,"Nei, det ble slutt etter et par år.","No, it ended after a couple of years."
27,"Na er jeg singel, men det er greit. ","Now I'm single, but that's fine."
28,Jeg har det bra og har fått mange gode venner.,I am doing well and have made many good friends.
29,Hva gjorde du for å bli kjent med folk?,What did you do to get to know people?
30,"I begynnelsen folte jeg meg noksa alene, men heldigvis er jeg glad i å vare ute i naturen. ","In the beginning, I felt quite alone, but fortunately I love to last in nature."
31,"Jeg meldte meg på en organisert felltur, og der ble jeg kjent med mange.","I signed up for an organized joint trip, and there I got to know many."
32,Det ga meg et fint nettverk.,It gave me a nice network.
33,"Det var en god idé. Ja, ikke sant? Tusen takk til Den Norske Turistforening!",It was a good idea.Yeah right?Thank you to the Norwegian Tourist Association!
34,"Dessuten har jeg venner på Facebook som jeg diskuterer med, alt fra turutstyr til politikk.","Besides, I have friends on Facebook that I discuss with, everything from tour equipment to politics."
35,Den Norske Turistforening (DNT) ,The Norwegian Tourist Association (DNT)
36,DNT er Norges storste friluftsorganisasion med over 300 000 medlemmer. ,"DNT is Norway's largest outdoor organization with over 300,000 members."
37,Organisasjonen ønsker taså mange som mulig skal oppleve glede i naturen. ,The organization wants Taså many people as possible to experience joy in nature.
38,Deter et viktig bidrag lit bedre folkehelse. ,It is an important contribution to better public health.
39,"DNT organiserer turer bade for unge go gamle, og det finnes lokale lag rundt om i hele landet.","DNT organizes tours both for young Go old, and there are local teams around the country."
40,LIVET I NORGE,Life in Norway
41,"Jeg heter Pari, og jeg er journalist. ","My name is Pari, and I am a journalist."
42,"Jeg er gift med Hamid, og vi har to barn, Sara og Darian. ","I am married to Hamid and we have two children, Sara and Darian."
43,Vi kom til Norge for 15 år siden.,We came to Norway 15 years ago.
44,"I Iran jobbet jeg som journalist i en avis, og Hamid var lege. ","In Iran I worked as a journalist in a newspaper, and Hamid was a doctor."
45,"Vi var begge politisk aktive, og det ble veldig vanskelig for oss. ",We were both politically active and it became very difficult for us.
46,"Politiet arresterte oss flere ganger, og til slutt mâtte vi flykte. ","The police arrested us several times, and in the end we flee."
47,"Vi reiste sammen med barna våre, fœrst til Tyrkia, senere til Norge.","We traveled with our children, first to Turkey, later to Norway."
48,"De første årene i Norge var utfordrende, med et nytt språk, en ny kultur og andre måter å leve på. ","The first years in Norway were challenging, with a new language, a new culture and other ways of living."
49,Hamid og jeg måtte lære oss mye nytt. ,Hamid and I had to learn a lot of new ones.
50,"Vi gikk på norskkurs, men det var mange ting vi ikke visste om Norge, og det var si få vi kunne spørre. ","We went on a Norwegian course, but there were many things we did not know about Norway, and there were few we could ask."
51,"I Iran hadde vi et stort nettverk av familie og venner, men her kjente vi ingen.","In Iran we had a large network of family and friends, but here we did not know."
52,"«Livet er ikke for amatører,» sier mange. ","""Life is not for amateurs,"" many say."
53,"Det er feil, mener jeg. ","It's wrong, I mean."
54,"Vi er alle amatører, men vi må lære oss å mestre livet så godt vi kan. ","We are all amateurs, but we must learn to master life as best we can."
55,"Livet i Norge var vanskelig, men na har jeg det fint. ","Life in Norway was difficult, but now I am fine."
56,"Gjennom introduksjonsprogrammet fikk jeg en pråksisplass, først i en butikk og så på et kontor. ","Through the introductory program I got a bargain space, first in a shop and then in an office."
57,Drommen min var likevel a jobbe som journalist. ,My dream was still working as a journalist.
58,"Etter noen år begynte jeg å jobbe for meg selv, og i dag skriver jeg artikler for persiskspråklige medier.","After a few years I started working for myself, and today I write articles for Persian -language media."
59,Der skriver jeg om nyheter fra Skandinavia.,There I write about news from Scandinavia.
60,å jobbe på denne maten har sine positive sider.,Working on this food has its positive sides.
61,"Jeg er min egen sjef, og jeg bestemmer arbeidstida selv.","I am my own boss, and I decide working hours myself."
62,"Sonnen var, Darian, er 18 år og går på videregående skole. ","The son was, Dary, is 18 years old and goes to high school."
63,"Han strever på skolen, men jeg håper at han greier eksamen. ","He struggles at school, but I hope he will do the exam."
64,Utdanning er viktig. For Sara har alt vert lettere. ,"Education is important.For Sara, everything has become lighter."
65,Hun gjorde det bra på skolen og begynte å studere farmasi rett etter videregående. ,She did well at school and started studying pharmacy right after high school.
66,Hun er snart ferdig med studiene.,She's soon finished her studies.
67,"Jeg setter pris på friheten i Norge,men jeg kommer alltid til å savne det jeg har mistet: familien min, vennene vare og naboene våre. ","I appreciate the freedom in Norway, but I will always miss what I have lost: my family, friends and our neighbors."
68,Noen ganger kan jeg kjenne en lukt som minner meg om Iran. ,Sometimes I can feel a smell that reminds me of Iran.
69,"Da stopper jeg, lukker øynene og drømmer meg tilbake til gatene i Teheran.","Then I stop, close my eyes and dream back to the streets of Tehran."
70,Fra Argentina til Norge,From Argentina to Norway
71,I boka OG skriver Veronica Salinas om hvordan hun synes det var å flytte til Norge fra Argentina.,In the book and writes Veronica Salinas about how she thought it was to move to Norway from Argentina.
72,Jeg har det tungt der jeg bor. ,I am heavy where I live.
73,Deter noe som ikke er på plass.,There is something that is not in place.
74,Jeg tenker at jeg ma fokusere på gode ting. ,I think I must focus on good things.
75,Gode ting for meg i Norge.,Good things for me in Norway.
76,Jeg liker å lære nye ting.,I like to learn new things.
77,Jeg liker norskkurset mitt. ,I like my Norwegian course.
78,Jeg gjør det.,I'm doing it.
79,Jeg leser lit eksamen i norsk.,I read the exam in Norwegian.
80,Jeg ønsker å gjøre en bra eksamen.,I want to do a good exam.
81,Jeg prøver å finne ting som kan holde meg oppe. ,I try to find things that can keep me up.
82,Akkurat som dulche de leche iArgentina.,Just like the Dulche de Leche Iargentina.
83,Jeg prøver å finne mitt norske melkesyltetøy.,I try to find my Norwegian milk jam.
84,ET FLERKULTURELT SAMFUNN,A MULTICULTURAL SOCIETY
85,I dag bor det innvandrere fra over 200 land i Norge. ,"Today, immigrants from over 200 countries live in Norway."
86,I mange hundre år har det kommet folk hit for å arbeide. ,"For hundreds of years, people have come here to work."
87,"I 1920 var 2,8%a v befolkningen innvandrere. ","In 1920, 2.8%of the population was immigrants."
88,I dag er tallet cirka 15 %. ,"Today, the figure is about 15 %."
89,De fleste kommer hit for å jobbe. ,Most come here to work.
90,Andre er flyktninger og asylsokere eller kommer fordi de har familie her.,Others are refugees and asylums or come because they have family here.
91,Undersokelser fra SSB (Statistisk sentralbyra) viser at sju av ti nordmenn er positive til innvandring og til ulike kulturer. ,Statistics from Statistics Norway (Statistics Norway) show that seven out of ten Norwegians are positive about immigration and to different cultures.
92,De mener at et flerkulturelt samfunn er et bedre og mer spennende samfunn. ,They believe that a multicultural society is a better and more exciting society.
93,"Kvinner er mer positive enn menn, og unge mennesker er mer positive enn eldre.","Women are more positive than men, and young people are more positive than older ones."
94,"De som er positive, mener også at innvandrere må ta vare på og utvikle sin egen kultur. ",Those who are positive also believe that immigrants must take care of and develop their own culture.
95,"De som er negative, mener at innvandrere bør bli så lik nordmenn som mulig.",Those who are negative believe that immigrants should be as similar to Norwegians as possible.
96,Noen er redde for at den norske kulturen skal bli borte.,Some are afraid that Norwegian culture will be lost.
97,UTVANDRINGEN FRA NORGE,The emigration from Norway
98,I siste del av 1800-tallet dro mange nordmenn til Amerika for å prove lykken der. ,"In the latter part of the 19th century, many Norwegians went to America to try their happiness there."
99,"Noen hadde politiske og religiose grunner til å dra, men de fleste flyttet for a finne arbeid.","Some had political and religious reasons to go, but most moved to find work."
100,"Folketallet økte kraftig i Norge, og det var ikke arbeid til alle. ","The population increased sharply in Norway, and there was no work for everyone."
101,I begynnelsen var det folk fra landsbygda som reiste.,"In the beginning, people from the countryside traveled."
102,Senere utvandret folk fra byene. ,"Later, people emigrated from the cities."
103,"Noen ganger emigrerte hele familien, men ofte var det mannen som reiste først.","Sometimes the whole family emigrated, but often it was the man who left first."
104,"Når han hadde funnet seg noe gjøre, kom kona og barna etter. ","Once he had found himself doing, his wife and children came after."
105,I perioden 1825-1925 var det cirka 800 000 nordmenn som slo seg ned i USA.,"In the period 1825-1925, there were approximately 800,000 Norwegians who settled in the United States."
106,"Mange klarte seg bra, men noen ble skuffet, og de skrev brev hjem til venner og familie i Norge. ","Many did well, but some were disappointed, and they wrote a letter home to friends and family in Norway."
107,Her er litt fra brevene,Here's a little from the letters
108,"De ler av oss fordi vi ikke kan språket, og det gjor vondt.","They laugh at us because we can't speak the language, and it hurts."
109,Jeg måtte ta jobb som tallerkenvasker. Deter ikke lett å få en kontorjobb.,I had to take a job as a plate washing.It is not easy to get an office job.
110,Jeg tror jeg må gjøre som deg og reise hjem og gifte meg. ,I think I have to do like you and go home and get married.
111,Pikene her erikke bra piker. De har ingen god moral. ,The girls here are good girls.They have no good morality.
112,Du må gi meg adressen tilen riktig fin pike.,You have to give me the address to the really nice girl.
113,TRIKS FOR NYE NORDMENN,Tricks for new Norwegians
114,"Få deg hund og bli integrert på en, to, tre.","Get you dog and be integrated on one, two, three."
115,Noman Mubashir er journalist o programleder i NRK og har skrevet denne kronikken:,Noman Mubashir is a journalist O program manager at NRK and has written this chronicle:
116,"Hva er den beste maten å integrere seg på i Norge, spurte en mann meg nylig. ","What is the best food to integrate into in Norway, a man asked me recently."
117,Han var fra Syria og ville sa gjerne få norske venner og ikke minst bli flinkere til å snakke norsk.,He was from Syria and would like to make Norwegian friends and not least be better at speaking Norwegian.
118,Jeg tenkte meg litt om for jeg svarte: Få deg hund!,I thought a little because I replied: Get you a dog!
119,"Jeg har bodd i nabolaget i snart fire år, ","I have lived in the neighborhood for almost four years,"
120,"og for to måneder siden kjopte jeg en hund, en supersot liten valp som heter Mocca. ","And two months ago, I buyed a dog, a super foot little puppy called Mocca."
121,Og Mocca er en sosial magnet. ,And Mocca is a social magnet.
122,"For sa jeg «Hei» og «Morn» til toppen åtte naboer, men nå har jeg snakket med minst 80 i nabolaget. ","For I said ""hey"" and ""mother"" to the top eight neighbors, but now I have talked to at least 80 in the neighborhood."
123,Folk stopper og vil hilse på henne:,People stop and want to greet her:
124,"«Å så set hun var, hvilken rase er det, hva heter hun, kan jeg klappe, kan jeg hilse på henne, hvor bor dere ». ","""To see she was, what breed is it, what is she, what is she, I can clap, I can greet her, where do you live."""
125,Samtalen er i gang. ,The conversation is underway.
126,"Nysgjerrig som jeg er (ikke rart jeg ble journalist) spør jeg gjerne naboene hvor lenge de har bodd her, om de har barn, om de trives her oghva de jobber med.","Curious as I am (no wonder I became a journalist) I would like to ask the neighbors how long they have lived here, if they have children, if they thrive here and what they work with."
